,qid,query
861,1775,Venus' early history and CO2 atmosphere
862,1776,claims to be part of 97% disagree with contrarian argument on human impact on global warming
863,1782,Coral atolls drowning due to slow growth
864,1783,Internal variability cannot account for global warming over the past century
865,1784,CO2 increase due to human fossil fuel burning
866,1785,Global temperature rise continues
867,1786,CFCS and global warming
868,1789,CO2 limits can slow global warming
869,1790,Study finds low probability of both low and high climate sensitivities
870,1792,"Greenland's ice loss accelerating, adding meters to sea level rise"
871,1793,Arctic temperature rising sharply
872,1794,Ben Santer's role in the 1995 IPCC report.
873,1796,Natural cycles superimposed on a linear warming trend
874,1798,"global warming's impact on ice sheets, sea levels, and climate"
875,1799,Satellite transmissions small
876,1802,temporary drop in sea level in 2010 due to la nina
877,1806,IPCC's 95% confidence in human responsibility for global warming
878,1807,CO2 emissions smaller 100 years ago
879,1813,"Postma's model contains errors, does not undermine greenhouse effect"
880,1814,heat energy from earth
881,1815,humans and climate changes
882,1817,Greg Hunt's emissions reduction fund at $13.95 per tonne of carbon
883,1818,Hydrofluorocarbons (HFCs) more polluting than CO2
884,1819,no warming in 17 years
885,1821,conservatives' budget omitting climate change
886,1822,Trudeau's carbon tax to raise gas prices by 11 cents per liter
887,1824,Nature's carbon emissions
888,1825,Climate change hoax
889,1826,Air pollution delays
890,1827,Rob Portman votes for climate change bill
891,1829,climate change and isis
892,1830,Wind energy slows down wind
893,1831,Koch Industries' environmental impact
894,1834,Burning coal may cause future warming due to added CO2.
895,1837,BP wrote a major part of Kerry-Lieberman climate change bill
896,1842,Koko the gorilla issues a warning about climate change
897,1844,"After 9/11 attacks, no commercial air traffic"
898,1845,Alaska Sen Mark Begich supports carbon tax
899,1849,Australia has more solar coverage
900,1850,Households benefit $550/year from axing carbon tax
901,1851,Barack Obama and Joe Biden to establish 10% federal RPS for clean energy by 2012
902,1853,Barack Obama's proposal for funding state and federal agencies to protect fish and wildlife from climate change
903,1854,Global warming
904,1855,"Barack Obama helping Gulf Coast restore wetlands, marshes, and barrier islands for hurricane resilience"
905,1857,As Obama closes Mississippi River Gulf Outlet
906,1859,Nevada families without solar panels pay higher power bills to subsidize rooftop solar
907,1860,Bill Nye proposes penalizing families
908,1861,California legislators make climate change denial a crime
909,1862,global warming not caused by carbon dioxide
910,1865,James Hansen warns of up to 30 ft sea level rise in 50 yrs.
911,1866,Global temps increasing less than expected
912,1867,Connie Mack protecting Chevron from pollution lawsuit
913,1868,Currently Florida prohibits buying electricity from companies with solar panels.
914,1869,"Fewer Americans carpool today than in 1980, despite SUVs being a larger proportion of vehicle sales."
915,1871,Donald Trump believes climate change is Chinese hoax
916,1872,trump claims global warming hoax
917,1874,Donald Trump signs executive order on climate change
918,1875,Doubling CO2 levels would cause warming of 0.3-1.1°C
919,1876,Nancy Pelosi's Copenhagen trip cost
920,1877,Democrats offer amendment to acknowledge climate change as real and human-caused in jobs and energy bill.
921,1878,Scrap carbon tax
922,1880,Electricity rates higher in states with renewable energy targets
923,1882,every other american home or business goes solar
924,1887,Florida's regulatory climate for business
925,1890,Germany's use of renewables and CO2 output
926,1893,Global warming and Zika virus spread
927,1895,Palin believes climate change not man-made
928,1896,Carbon emissions reduced by 20% over 40 years using nature
929,1898,Solar heated water tanks in Florida
930,1901,"If sea levels rise 6ft due to climate change, Waterplace Park & Wickford Village"
931,1904,Solar energy from a 100-mile square area in the southwestern desert
932,1908,fracking's climate impact
933,1909,sea level rise in south florida since 1920s
934,1910,it takes as much energy as it generates
935,1912,Julia Gillard's decision not to argue against a fixed carbon price being labelled a carbon tax.
936,1917,May 2018 marked 401st straight months of global temperatures exceeding 20th century average
937,1919,"Measurements indicate Arctic sea ice increased, Greenland glacial ice didn't melt as much in 2017, casting doubt on global warming."
938,1920,Melting of Arctic sea ice and polar icecaps not occurring at unnatural rates
939,1921,"Miami Congressman Carlos Curbelo supports offshore drilling, repeatedly votes against President Obama's efforts to combat climate change."
940,1922,More money dedicated to climate change at Homeland Security than combating Islamist terrorism online in US.
941,1923,"over 260,000 Americans employed in solar industry, 3x more than coal mining"
942,1928,Antarctica gaining ice
943,1931,"New Jersey loses 50 football fields of open space daily due to development, exacerbating downstream flooding."
944,1932,Newspaper article from 1922 discussing Arctic Ocean climate change
945,1933,Newt Gingrich teamed with Nancy Pelosi and Al Gore on global warming
946,1935,No state generates as much solar power as California.
947,1937,"Co2 not a pollutant, higher levels support ecosystems."
948,1938,Obama's Clean Power Plan and CO2 emissions
949,1943,most scientists believe human contribution to climate change
950,1944,United States reduced carbon pollution over eight years
951,1945,President Trump criticizes Belgian government over Paris climate deal
952,1946,"Obama's proposal allows US to cut carbon emissions, while China/India can increase theirs."
953,1947,President Trump's climate change pick
954,1948,Recent record low water levels in Lake Michigan
955,1951,Scientists question man-made global warming causing climate change
956,1952,Arctic to be ice-free in summer 2013
957,1953,Scotland's toughest climate targets
958,1955,George Lemieux voted to let oil companies off hook
959,1960,Solar panels harness the sun's energy
960,1962,Earth surface temperatures stabilized
961,1963,Tallahassee reduces carbon intensity by 40%
962,1968,early start to daylight saving time and global warming
963,1970,Business councils call for carbon tax repeal
964,1971,wind energy footprint
965,1973,carbon tax's impact on Alcoa's Point Henry Aluminium smelter
966,1975,Scientists believe humans cause climate change
967,1977,China's commitment under the Paris Agreement
968,1980,Three Nobel economists support direct tech investment over carbon tax
969,1981,EPA Director under Obama said Clean Power Initiative wouldn't affect CO2 emissions
970,1983,Polar vortex and ice not melting
971,1984,most recent survey of climate scientists on co2 climate change
972,1985,Pole ice changes
973,1986,The Obama administration constrained by the Oil Pollution Act of 1990
974,1987,Obama's coal mining proposal
975,1988,The Obama administration's EPA says Clean Power Plan has marginal impact on climate change
976,1991,United States leads world in doubting climate change
977,1995,"solar energy jobs in US, except Georgia"
978,1996,solar industry jobs outnumber coal mining jobs
979,1998,climate change and nsw bushfires
980,1999,No relationship between temperature and carbon dioxide emissions
981,2000,There isn't a Republican primary candidate
982,2004,They Clinton and Obama not involved in climate change
983,2008,Tony Abbott must respect government's mandate on carbon tax
984,2009,Top scientist Hal Lewis resigns over climate change
985,2011,"U.S. pays $1 billion to Green Climate Fund, top polluters pay nothing"
986,2012,"Sen Ron Johnson led fight to allow unlimited carbon pollution and took $225,000 from polluters"
987,2013,Sen Ron Johnson voted to allow unlimited carbon emissions
988,2020,Weather Channel co-founder John Coleman claims global warming is a hoax.
989,2021,Weather Channel co-founder John Coleman's claims about climate change.
990,2024,Wisconsin employers cite anti-business litigation climate as key factor in expansion decisions
991,2027,Increased ice Antarctica due to global warming
992,2028,Cutting speed limits
993,2029,Bill Gates warns pandemic misery will happen regularly if climate change isn't stopped
994,2030,Opponents of climate action getting more airtime than proponents
995,2032,Current solar minimum
996,2034,IPCC AR5 temperature forecasts exceeded actual readings
997,2036,Global surface temperature change
998,2037,renewable energy installations in EU 2018 less than half 2010
999,2038,Australian droughts occurred when global temperatures were lower
1000,2040,Australia reducing emissions
1001,2041,reduced query: flaws in statistical analysis justifying government action
1002,2042,Recent research indicates fossil fuel quantities in atmosphere less
1003,2047,Contrary to rising temperature caused by increasing CO2
1004,2048,CO2 a greenhouse gas
1005,2049,The millennium drought
1006,2052,no evidence 7000 ppm CO2 causes ocean acidity
1007,2054,cooling of climate despite rising CO2 levels (1940-1976)
1008,2055,"Over the past one million years, climate cycles caused by solar energy, planetary alignments, and ocean currents."
1009,2057,"increase in atmospheric methane in late 20th century initially attributed to grazing & rice cultivation, but actually due to Soviet pipeline leaks"
1010,2058,"Methane levels stable, fluctuating during El Nino events"
1011,2059,Heat wave increase
1012,2060,hurricanes strengthening due to global warming
1013,2062,Global warming increases droughts and floods
1014,2065,Global warming causes snow disappearance
1015,2067,"Arctic, Antarctic, Greenland ice loss accelerating due to global warming"
1016,2068,Global warming responsible for 2019 July warmth in Alaska
1017,2069,ocean acidification harming marine life
1018,2070,"When life is considered, ocean acidification is often found to be not a problem or even beneficial"
1019,2071,carbon pollution hazard
1020,2075,rate of global sea level rise falling
1021,2076,Snowfall increasing in North America
1022,2077,increase in damage due to population growth in vulnerable areas and poor forest management
1023,2078,floods and droughts unchanged since fossil fuel use
1024,2081,heat wave frequency decrease since 1930s
1025,2083,Climategate emails suggest conspiracy
1026,2084,hurricanes and global warming
1027,2086,global warming causes extreme weather
1028,2090,Arctic ice melt
1029,2091,water vapor
1030,2092,polar bear numbers
1031,2093,CO2's impact on public health
1032,2096,coming out of the little ice age
1033,2099,Thermodynamics contradicting greenhouse theory
1034,2100,IPCC Himalayan glaciers
1035,2101,cloud feedback
1036,2103,IPCC was wrong about Amazon rainforest
1037,2104,Greenland ice sheet not collapsing
1038,2105,CO2 residence time over 100 years
1039,2106,decline in global temperature
1040,2110,climate change
1041,2111,Global warming
1042,2113,IPCC temperature rise
1043,2114,corrupted peer review process
1044,2117,"Sea level rise since 1880, future sea level rise predictions"
1045,2118,humans insignificance in affecting global climate
1046,2119,Lindzen and Choi find low climate sensitivity
1047,2120,Phil Jones' statement about no global warming since 1998
1048,2121,Infrared iris reducing global warming
1049,2122,Dropped stations warming bias
1050,2123,Tree rings diverging from temperature after 1960
1051,2127,"Over 31,000 scientists sign OISM petition"
1052,2128,less than half of scientists endorse global warming
1053,2130,stomatal CO2 levels
1054,2132,foi requests ignored
1055,2134,Tuvalu sea level not rising
1056,2136,renewables cannot provide baseload power
1057,2141,satellite error and great lakes temperatures
1058,2142,Soares finds no CO2-temperature link
1059,2144,Human caused global warming disproof
1060,2147,exponential increase in CO2 leads to linear increase in temperature
1061,2150,adapting to global warming cheaper than preventing
1062,2152,Venus' greenhouse effect
1063,2153,sunspot correlation
1064,2157,CO2 increase not human caused
1065,2160,renewable energy investment kills jobs
1066,2161,CO2 limits won't cool the planet
1067,2163,"Schmittner et al. study finds low prob. of both low & high climate sensitivities, with lower IPCC estimate based on new LGM temp. reconstruction"
1068,2164,Greenland's ice loss
1069,2165,Ben Santer rewritten the 1995 IPCC report.
1070,2167,embrace skepticism
1071,2168,IPCC graph showing accelerating trends
1072,2170,Extreme weather damage costs increasing due to climate change
1073,2171,UAH atmospheric temperatures
1074,2173,global warming during industrial revolution
1075,2178,Loehle and Scafetta's 60-year cycle
1076,2181,humans survived past climate changes
1077,2184,alligators found in Spitzbergen during ice ages and warmer periods
1078,2187,"Greenhouse gases, particularly CO2, controlled ancient climate changes."
1079,2189,Humans' CO2 emissions main cause of climate change
1080,2192,Solar activity influences global climate warming
1081,2193,Global warming sun cooling trend
1082,2199,consequences of climate change worsen with each degree of warming
1083,2200,petition by 31000 scientists on CO2 and global warming
1084,2201,Academies of science and climate science organizations agree on human-caused global warming.
1085,2202,More specifically climate researchers endorsing consensus position
1086,2204,Global warming
1087,2205,"Global warming stopping, cooling beginning"
1088,2206,most climate models predict warming
1089,2208,"Earth's heat content accumulating, global warming"
1090,2209,Surface temperatures cool
1091,2210,Models' fudge factors fit to climate data
1092,2212,"While uncertainties exist with climate models, they accurately replicate past trends."
1093,2213,Warming trend in rural and urban areas
1094,2214,"weather stations near air conditioning units, asphalt, roads, sidewalks, and buildings"
1095,2215,waste digestion temperatures higher than surrounding areas
1096,2217,Urban heat island effect and microsite influences have negligible effect on long term trends
1097,2219,increase in temperatures since 1975
1098,2221,Natural temperature measurements confirm accuracy of instrumental temperature record
1099,2222,global climate change and mass extinctions
1100,2223,Climate change's rapid pace makes adaptation via migration unlikely for many species.
1101,2227,Earth's climate system warming since 1998
1102,2229,"Antarctica losing land ice at accelerating rate, implications for sea level rise"
1103,2230,Ice expanding in Antarctica
1104,2236,majority of peer reviewed research predicted warming due to increasing co2
1105,2238,Rise in CO2 lags temperature rise by 200-1000 years
1106,2241,Earth's orbit warming
1107,2242,oceans releasing co2
1108,2243,CO2 amplifying warming
1109,2244,CO2 causes warming
1110,2245,CO2 increase causes global warming
1111,2246,"Dr. Spencer's latest research shows that IPCC-imagined temperature feedbacks are net negative, attenuating warming instead of enhancing it in the short term."
1112,2247,"Best estimate: warming from CO2 doubling may be 1°F, not 6°F predicted by IPCC."
1113,2248,Climate sensitivity can be calculated empirically
1114,2250,"Global warming skeptics argue low climate sensitivity, 1°C temperature change from doubled CO2."
1115,2255,"Ice Age ended 11,500 years ago"
1116,2256,warming effect from CO2 vs Earth's orbit/solar activity
1117,2257,harmless emissions of carbon dioxide can't acidify oceans
1118,2260,Increasing ocean acidity
1119,2261,Oceanography journal's PH projections
1120,2262,Since 1998 hockey stick paper
1121,2263,"Hockey stick conclusion, 20th century warmest in 1000 years, warming most dramatic after 1920"
1122,2266,Investigations found no evidence of wrongdoing
1123,2267,Suggestive emails distract from empirical evidence for man-made global warming
1124,2268,"""emails and documents show evidence of a scandal involving prominent scientists promoting man-made warming theory"""
1125,2272,"scientists' honesty not in doubt, IPCC conclusions unaffected by behavior"
1126,2275,Constant global storm coverage
1127,2276,Warming increases hurricane intensity
1128,2277,An expert witness said Al Gore's film was broadly accurate.
1129,2280,"While there are minor errors in An Inconvenient Truth, the main truths presented, evidence to show mankind is causing global warming and its various impacts is consistent with peer-reviewed science."
1130,2282,Glaciers worldwide retreating
1131,2283,accelerating global melt rate since 1970s
1132,2284,"Cosmic ray counts increasing, global temperature cooling"
1133,2286,Regulating earth's cloud cover affects sun's temperature
1134,2288,Cosmic rays and global temperatures over 30 years
1135,2289,Recent years cosmic rays record temperatures
1136,2290,"Hypothetically, increasing solar magnetic field deflecting galactic cosmic rays seeding low-level clouds decreasing Earth's reflectivity causing global warming"
1137,2293,Steve McIntyre noticed a strange discontinuity in US temperature data
1138,2295,Warmest year on US record is 1934
1139,2298,USA's temperature record in 2012
1140,2300,Austria sees earliest snowfall in history
1141,2302,Global temperatures warming 0.2°C/decade since 1970s
1142,2303,weather affects long term trend
1143,2304,record cold temperatures during global warming
1144,2305,Record high temperatures occurring twice as often as record lows
1145,2308,likely natural droughts of the 20th century
1146,2312,Tuvalu sinking
1147,2313,Local tide gauge disagreed with no sinking around 1990
1148,2317,sea level rise accelerating
1149,2318,Ross Mckitrick and Patrick Michaels' paper
1150,2319,Urban areas warmer than rural areas have little impact on warming trends
1151,2320,While Medieval warm period saw unusually warm temperatures globally
1152,2323,Mars warming
1153,2325,"Mars' climate driven by dust and albedo, no long-term warming evidence."
1154,2326,Record low ice coverage in northern hemisphere 2007
1155,2328,late 1970s data on what
1156,2329,Northwest Passage open
1157,2330,Arctic sea ice retreating
1158,2333,minor greenhouse gases like CO2 warm the earth
1159,2335,Satellite measurements of infrared spectra over 40 years observe less CO2 energy escape.
1160,2336,downward infrared radiation warming the planet's surface
1161,2337,CO2 causes global warming
1162,2338,amount of warming caused by anthropogenic co2
1163,2344,Early Argo cooling bias
1164,2347,reduced query: most climate research funding comes from federal govt and left-wing foundations
1165,2358,co2 emissions balanced by natural absorptions
1166,2359,Human emissions upset CO2 levels
1167,2360,Human CO2 emissions vs. atmospheric rise
1168,2361,IPCC formed to build case for human cause of global warming
1169,2363,IPCC lead authors
1170,2365,Climate change occurring more rapidly and intensely than IPCC predictions
1171,2366,Increased CO2 and water vapor amplify warming
1172,2369,Clear evening skies lead to temperature drop and frost.
1173,2370,"If there's cloud cover, heat is trapped."
1174,2374,water vapour dominant greenhouse gas
1175,2377,Polar bear population trends
1176,2378,costs of inaction vs costs of mitigation
1177,2381,Economic assessments of carbon pricing
1178,2384,Economy harmed by not implementing CO2 limits
1179,2387,"Greenland ice sheet at least 400,000 years old, warming not global 1,000 years ago"
1180,2390,There may have been greener Greenland
1181,2391,Greenland's ice loss
1182,2394,Greenland ice sheet thickness increase from 1993 to 2003.
1183,2395,Greenland's coastlines losing ice
1184,2396,Greenland losing ice mass
1185,2398,CO2's primary impact on oceans.
1186,2399,"excessive greenhouse effect impacts agriculture, health, environment"
1187,2400,CO2's role in life on Earth
1188,2401,Mother Earth has ruled CO2 not a pollutant
1189,2402,CO2 poses a threat to public health and welfare
1190,2406,CO2 and water required for photosynthesis
1191,2409,"Less energy escapes to space due to CO2 acting as a blanket, with increasing CO2 making it thicker."
1192,2410,Carbon dioxide emissions and global warming
1193,2411,Reduced query: can computer models be considered as evidence?
1194,2413,CO2 absorption wavelengths
1195,2414,Ocean temperature measurements continue to accumulate heat
1196,2417,"Mars, Triton, Pluto, Jupiter's climate influenced by Sun"
1197,2420,Sun's temperature since 1950
1198,2422,"As of today, JAXA shows more ice than any other day in the past 8 years of Aqua satellite measurements for AMSR-E dataset."
1199,2423,"Arctic sea ice thinning, sea ice extent increasing"
1200,2424,Arctic sea ice in 2008 and 2009
1201,2426,Global warming started in 1910
1202,2427,By that time CO2 emissions
1203,2428,Rapid rise in global CO2 emissions since 1945
1204,2429,"with rapidly increasing global temperatures and minor co2 increase, then slowing temperatures with rapid co2 rise, IPCC's co2 claim was deceitful"
1205,2430,"Even during long-term warming, short periods of cooling"
1206,2431,Cooling due to La Nina and solar minimum
1207,2432,Sun's warming stopped since 1970
1208,2434,IPCC blames human CO2 emissions for warming
1209,2438,Greenhouse gases warming since 1970
1210,2441,planet not simply recovering from Little Ice Age
1211,2444,"Forcings affecting climate, including stratospheric aerosols and solar variations"
1212,2445,Combined forcings correlate with global temperature
1213,2447,Global dimming due to anthropogenic sulfate aerosol emissions
1214,2449,January 2008 marked a 12-month period of global temperature drop.
1215,2453,"CO2 levels in Ordovician, Silurian, Jurassic, Cretaceous periods"
1216,2455,"CO2 levels higher, solar levels lower"
1217,2457,rise in temperature 1900-1940
1218,2460,six decades of abnormal warmth
1219,2461,Early 20th century warming
1220,2463,"Volcanic activity has been frequent, exerting a cooling effect"
1221,2464,early 20th century warming human influence
1222,2468,No significant global warming since 1979 despite rising CO2 emissions
1223,2474,Warming trends agree with surface temperatures and model predictions
1224,2476,Global dimming reversed around 1990
1225,2478,Kerr 2007 notes thinning of sunlight reflecting haze
1226,2482,global temperatures balanced
1227,2483,Britain's cold spell starts global cooling trend challenging climate change
1228,2484,Global temperature dip
1229,2485,anthropogenic greenhouse gases
1230,2486,minute increase of anthropogenic CO2 in atmosphere
1231,2487,El Nino Southern Oscillation and global temperatures
1232,2488,long term warming trend over past few decades
1233,2489,Australasian researchers show natural forces dominate climate
1234,2493,Mount Kilimanjaro's shrinking glacier
1235,2494,Earth's average temperature increasing
1236,2495,Gore claims Kilimanjaro's snowcap is shrinking due to global warming
1237,2497,Without humidity
1238,2499,Earth warmed since 1850
1239,2500,Believers think human-induced warming vs. skeptics believe natural causes with minor human impact
1240,2501,human fingerprint on global warming
1241,2502,Anthropogenic climate change predictions
1242,2506,IPCC confirms computer modeling predicts tropical mid-troposphere hot spot
1243,2508,PDO temperature pattern Pacific Ocean
1244,2509,PDO warm phase
1245,2510,pdo cool phase
1246,2511,PDO warm phase 1977
1247,2515,pdo last switched to cool phase
1248,2516,Earth's climate system energy imbalance
1249,2520,According to the second law of thermodynamics
1250,2521,atmosphere unable to absorb shortwave radiation from sun
1251,2522,thermal radiation escaping to space from cold upper atmosphere
1252,2523,this is the atmospheric greenhouse effect
1253,2530,Glaciers in rapid retreat worldwide despite IPCC report error
1254,2531,Glaciers in Central and Eastern Himalayas may disappear by 2035
1255,2536,IPCC AR4 confirmed by peer-reviewed literature
1256,2538,Himalayan glaciers disappearing at an accelerating rate
1257,2539,influence of greenhouse gases on near surface temperature
1258,2540,no proof of greenhouse effect's connection to global warming
1259,2542,"Greenhouse gases, especially CO2, contradict physical laws."
1260,2547,the modelers confused cause and effect
1261,2549,climate change settled
1262,2552,"geologic record shows abundant evidence of natural climate variability, including icecaps near equator and none at poles"
1263,2553,climate debate 16w/m²
1264,2555,areas of science understood with varying degrees of certainty
1265,2556,Aerosol vs CO2 warming effect
1266,2557,Well understood aspects of climate change
1267,2560,Sea level rise since last ice age
1268,2561,observed sea levels tracking upper range IPCC projections
1269,2562,accelerating ice loss from Greenland and Antarctica in sea level projections by 2100
1270,2564,warming due to ocean salinity variations
1271,2565,Recent temperature changes
1272,2568,IPCC made false Amazon rainforest predictions based on non-peer-reviewed WWF paper
1273,2570,IPCC statement on Amazon rainforests
1274,2571,"error in citation, missing peer-reviewed papers"
1275,2574,coral reefs declining
1276,2575,"Coral destruction in Caribbean, Indonesia, Pacific over 30-40 years"
1277,2577,Recent articles question coral reef trouble due to greenhouse gases
1278,2579,CO2 increase over 250 years
