,qid,query
428,945,"Sea level rise by end of century, potentially accelerating in 22nd century"
429,948,Robert Deconto's computer model predicts climate outcomes under sharp emissions reduction.
430,949,Under Antarctica stable
431,952,"Alaskan tundra warming, becoming net CO2 emitter"
432,954,Melting permafrost releases methane
433,956,"Data from NOAA Barrow Alaska station show CO2 emissions from surrounding tundra increased 73% since 1975, supporting Arctic ecosystems as net CO2 source."
434,957,Arctic temperatures below -20C
435,960,global temperature trend shows no further warming
436,962,Arctic sea ice extent in April
437,967,Warming cycles since 900 AD
438,971,Sea ice diminishing fast
439,972,Arctic carbon storage
440,976,pingoes
441,978,extreme weather patterns intensifying
442,979,Recent 5-year drought with driest 4-year period on record
443,982,Climate change causing extreme weather swings?
444,983,dry periods drier wet periods wetter
445,988,unlikely scenarios becoming more probable
446,990,drainage systems and seawalls in South Florida no longer sufficient
447,991,Sea level rise
448,993,rise in sea level at Virginia Key tide gauge
449,994,Says who has authored sea level rise studies
450,995,Jet stream flow strong when temperature difference large
451,996,When Arctic warms up faster
452,997,Scientists debate planet's warming impact on weather
453,1001,Enhanced high latitude warming triggers remote weather impacts
454,1003,Arctic sea ice loss linked to Eurasian winter cooling?
455,1007,"Levels of carbon dioxide in the atmosphere breaking new records, human activities' influence on climate system evident."
456,1009,Arctic ice conditions at record low since October
457,1010,Arctic changes affecting us
458,1011,"melting of Greenland ice sheet contributes to sea level rise, Arctic sea ice affects European Asian and North American weather"
459,1013,Global sea level rise surged between November 2014 and February 2016
460,1014,Final 2016 sea level rise
461,1017,Our children and grandchildren will look back on climate deniers.
462,1019,El Niño weather pattern peaked in 2016
463,1020,The global reef crisis does not necessarily mean extinction for coral species
464,1021,"corals saving themselves by moving towards poles, establishing new reefs"
465,1022,Damaged Great Barrier Reef recovering in 10-15 years
466,1023,"Within a decade, certain branching and plate corals may be extinct."
467,1024,Water vapor accounts for 95% of greenhouse gases.
468,1028,coats of paint have little to no impact after two
469,1034,Odds of correctly guessing outcome of a flipped coin
470,1038,"95^15 = 362,880,375"
471,1040,"While Earth's orbital variations impact radiation levels, and thus global temperatures..."
472,1048,"Widespread record warmth in US, part of long-term trend towards more warm temperature records."
473,1049,nearly 5000 daily record highs vs 42 daily record lows
474,1050,warmest temp in Albany NY Dec-Jan-Feb
475,1052,warmer upper ocean layers prevent mixing with cooler deeper layers
476,1055,Human-driven warming linked to oxygen decline
477,1056,Because oxygen decline
478,1057,moreover ocean contains oxygen minimum zones
479,1061,Warmer oceans destabilizing Greenland and Antarctica glaciers
480,1065,However California's climate has been...
481,1066,Extremely warm dry and wet years becoming more frequent
482,1067,extremely warm years rare
483,1069,less sea ice on earth than ever recorded
484,1073,Arctic summer sea ice decline due to man-made global warming
485,1075,Sea ice at record low levels in Antarctica.
486,1077,"Antarctic ice fluctuations year to year, Walt Meier's view on NASA."
487,1078,Sea ice regulating planet's temperature
488,1079,NASA declares 2016 as warmest year on record.
489,1082,Schmidt argues NOAA and NASA differences are insignificant in a broader context.
490,1083,Trends since 1970s continue
491,1084,"Jonathan Overpeck no doubt about it anymore, humans mainly burning fossil fuels cook planet"
492,1087,Record cold temperatures in stratosphere
493,1088,Ongoing long term warming trend
494,1089,"Last year's warmth was manifested globally, with record-breaking events in Australia's Great Barrier Reef and Arctic sea ice."
495,1090,Extreme high temperatures seen in India and Iran.
496,1092,Mike Wallace's research found no reduction in oceanic pH.
497,1093,Ocean acidification due to CO2 emissions.
498,1097,"Impact of pH lowering on calcification, metabolism, growth, fertility, and survival of calcifying marine species."
499,1098,ocean acidification
500,1103,ocean acidification in 2003
501,1108,There is a bias in scientific journals towards publishing doomsday stories
502,1109,Rising global temperatures cause sea ice to melt
503,1112,The jet stream forms a boundary between cold north and warm south.
504,1113,Jet stream meanders bring warm air to the North and cold air to the South.
505,1115,extreme events can unfold
506,1116,Severe snowmageddon winters linked to soaring polar temperatures
507,1119,Arctic ice shrinkage linked to climate change
508,1120,Connection between Arctic ice and extreme summer weather
509,1121,Fast Arctic melting raises possibility of worse extreme weather
510,1127,2016 may be declared as hot as 2015 due to El Nino.
511,1130,Record warm years 2015-16 caused by Super El Nino
512,1133,Global temperature drop since mid-year
513,1135,"Mass bleaching event on Great Barrier Reef kills more corals than ever before, destroying over 2/3"
514,1136,Coral bleaching when water temperatures rise
515,1138,Stress from warm ocean water
516,1139,coral bleaching linked to global warming
517,1141,Surprising Antarctic sea ice decline
518,1142,Arctic sea ice decline vs Antarctic sea ice increase
519,1143,"Skeptics point to southern hemisphere ice gain as evidence of no climate change, but scientists attribute it to natural atmospheric variations."
520,1144,Antarctica's ice not increasing
521,1145,Sea ice Arctic Antarctic record lows
522,1146,Arctic/Antarctic warming with less ice
523,1149,Arctic temperatures soaring
524,1150,Water temperatures in Arctic Ocean above average due to less sea ice.
525,1151,"unlike genuine pollutants, CO2 is odorless and colorless."
526,1154,CO2 maintains Earth's habitable temperature
527,1155,Increased CO2 levels causing modest and beneficial warming
528,1156,"Emissions regulations' costs will be punishingly high, providing no benefits."
529,1157,"US farm output in 2013 was 27 times 1948 level, with growing productivity."
530,1160,Feeding 9 billion people with increased CO2
531,1163,Global warming and climate change caused by humans.
532,1164,natural disasters showing no long term change
533,1166,Droughts in Western US compared to ancient mega droughts
534,1167,Recent hurricane activity Gulf of Mexico
535,1169,Sea level rise
536,1170,Are you worried about sea level rise?
537,1171,"Hillary's sea level rise claim in Norfolk, Virginia"
538,1173,Until renewable energy makes up 15-20% of global energy requirements
539,1175,observed warming vs computerized climate models
540,1178,most famous 2010 study by kenchi and webb
541,1180,Rising sea levels reducing land area
542,1181,"Coral breaks down, washing up as sand on low-lying islands."
543,1183,Residents flee atolls sinking
544,1186,President Hilda Heine says longtime Marshall Islands residents leave due to climate change threat
545,1188,Policy makers looking at Marshall Islands' resilience
546,1198,Fracking makes American gas cheap
547,1202,discrepancy between model predicted warming and real world observations inspires new respect for natural climate variability
548,1204,UN warned of rising sea levels washing away countries if global warming wasn't checked by 2000
549,1205,Gordon Brown predicted 50 days to save the planet from global warming
550,1211,Climate economists see a positive externality from human influence on climate
551,1212,social cost of carbon negative
552,1216,"avoiding frank discussion about budget deficits, federal debt, school choice, entitlement reform"
553,1219,Global warming speeds up Greenland glacier melting
554,1222,melting Greenland ice sheet's impact on sea levels
555,1223,Ice cap disappearing rapidly
556,1224,Sunny day flooding along East Coast and Gulf Coast
557,1227,These tidal floods
558,1230,Pacific coast sea level rise
559,1235,Ice age sea level drops over 400 feet due to Earth's orbital wobble
560,1237,last sea level high point 125 000 years ago
561,1239,Research shows human civilization 6000 years old
562,1240,Ice-free
563,1243,Central Arctic ice-free
564,1245,There will still be about a million km² of ice in Arctic in summer
565,1246,Arctic summer sea ice cover to hit record low
566,1247,Arctic summer as symbol of global change
567,1251,"Underneath permafrost, methane hydrates"
568,1253,IPCC predicts sea level rise 60-90 cm this century
569,1255,First scientists to show Arctic icecap thinning
570,1256,Arctic to lose its ice
571,1257,ocean warming → more water vapor
572,1259,"Heavy rainfall episodes in NE, Midwest, Upper Great Plains; drought in West, especially California."
573,1260,contrast in precipitation between wet/dry regions and seasons
574,1265,Floods and storms linked to climate change
575,1266,world 1C warmer than pre-industrial times
576,1268,thermal expansion of oceans and melting glaciers caused highest global sea level on record in 2015
577,1269,oceans absorbing most of extra CO2
578,1270,"Alpine glaciers record 36th consecutive year of net ice loss, Greenland ice sheet melts over 50% of its surface"
579,1271,Greenland's ice sheet melting and its impact on sea levels
580,1273,"rapid climate change consequences for humans and species, including droughts causing food shortages in Ethiopia and forest fires in Indonesia."
581,1276,Scientists use climate models with human factors vs. natural factors to study attribution.
582,1279,earlier this month NASA's visualization of Earth getting greener
583,1284,Greening and blunting impacts of greenhouse gas emissions
584,1286,"Arctic greening, US Geological Survey, Alaska, carbon storage."
585,1292,reasonable people recognize positives and negatives in Tory and Labour policies
586,1293,"By 2070s, UN climate panel finds global warming causing 0.2-2% GDP damage"
587,1294,Because CO acts as a fertilizer
588,1296,Global warming making the world greener
589,1299,Recent study: hurricane damages halving due to global warming
590,1300,Yet a new study of climate models shows warming may not lead to increased precipitation.
591,1303,Global warming being a good thing
592,1304,Lord Krebs tells Times to focus on positive climate news.
593,1305,Great Barrier Reef's resilience to climate change
594,1307,"A new study finds human caused global warming causes Great Barrier Reef bleaching, may kill parts by 2030s."
595,1308,Barrier Reef perishing by 2030s
596,1310,it occurred during the warmest year on record in 2015
597,1312,UNESCO World Heritage site under threat from hot ocean temperatures
598,1313,Coral bleaching devastates Great Barrier Reef
599,1314,Higher temperatures killing thousands to tens of thousands Americans
600,1315,cold kills more people
601,1316,Administration's report undermines climate action
602,1317,Climate change reducing cold days
603,1322,"Temperatures rise, reduction in premature deaths from cold vs. increase in deaths from heat in US"
604,1324,Cold deaths moderate temperatures
605,1325,"Lancet researchers find 0.5% of deaths linked to heat, including cardiac events and dehydration."
606,1326,"Deaths from cold-related illnesses, including hypothermia, increased blood pressure, and heart attacks."
607,1327,Migration patterns to warm states
608,1331,"More than half of 44 studies found CO2's impact on marine life (crabs, limpets, sea urchins, sponges)"
609,1333,ocean buffering capacity
610,1334,Can we release enough CO2 to make pH < 7?
611,1339,Dr. Browman's statement on ocean acidification
612,1342,worsening of tidal flooding in American coastal communities due to greenhouse gases from human activity
613,1343,Roughly three quarters of tidal flood days in east coast towns due to sea level rise from human emissions
614,1347,"Recent Paris climate agreement not ambitious enough to prevent Greenland and Antarctica melting, but may slow pace."
615,1350,Until late 1990s
616,1351,Marginally significant warming trend
617,1353,"Temperatures in 1999 were nearly 0.3°C lower than in 1998, with a similar expected change this time."
618,1354,La Niña
619,1357,Is worldwide weather becoming more extreme?
620,1360,trend in downward
621,1362,2015 not hottest year on record
622,1365,Satellite temperature readings since 1979 show 1998 as warmest.
623,1367,"Temperatures were warmer than today for most of the past few thousand years, including during human civilization."
624,1369,Record El Niño temperatures
625,1372,El Niño continues into 2016
626,1374,"Temperatures rise slowly, less than half as fast as predicted in 1990."
627,1375,The world is warming by 0.5°C
628,1376,"planet was warmer than today several times in past 10,000 years"
629,1377,"no change in frequency/intensity of storms, floods, and droughts; fewer deaths from these disasters"
630,1378,Antarctica gaining land-based ice
631,1381,"Temperatures 15-45°C, 27-81°F warmer by the end of the century"
632,1383,Warming may bring gains due to CO2 causing crops and ecosystems to grow greener and more drought-resistant.
633,1384,Cooling impact of sulfate emissions on global warming
634,1386,"Global warming alarmists' preferred electricity source, wind power, kills nearly 1 million bats annually and over 500,000 birds in the US."
635,1387,Killing 30m bats annually due to climate change concerns
636,1389,Why not 2014 Queensland heat wave as severe as 1972?
637,1390,Lyme disease commoner in northern US regions
638,1394,Pine beetle infestations decline in western US
639,1395,extreme weather events and their costs decline with warming
640,1397,Alarmists claim healthier plants due to global warming are a bad thing.
641,1399,Since 2012
642,1400,late 70s marked end of 30 year cooling trend
643,1401,Polar ice caps extensive since 1920s
644,1402,polar ice recession since 2005
645,1404,Receding polar ice caps and their impact on human health and welfare
646,1406,Yet NASA says one temp sensor needed
647,1407,Temperature is not an amount.
648,1410,"temperature, viscosity, density, phone numbers cannot be averaged"
649,1411,Global temperature statistic
650,1414,Earth's mini ice age in 15 years
651,1416,"Recent decades' warming, rising sea levels, increasing extreme weather events"
652,1420,trapped in the atmosphere these gases prevent sun's warmth from being dispersed
653,1421,Methane release from polar ice caps and high altitude plains
654,1425,"Each year, thousands of plant and animal species disappear."
655,1426,coral reefs in decline
656,1430,warmest years since 2000
657,1431,"Deforestation causes 11% of human greenhouse gas emissions, comparable to car and truck emissions."
658,1433,11% of global population vulnerable to climate change impacts
659,1434,Just 0.07 of world's forests are coastal mangroves yet they store up to 10 times as much carbon per hectare as tropical forests
660,1435,"Coastal ecosystems destroyed annually, releasing CO2."
661,1441,195 countries sign Paris Agreement
662,1444,"Natural climate solutions creating 80M jobs, bringing 1B people out of poverty, adding $2.3T growth"
663,1445,CO2 emissions from commercial operations in 2018
664,1447,"Flights from US airports emit a quarter of global passenger transport CO2, with two-thirds coming from domestic flights."
665,1448,top 5 countries for passenger aviation carbon emissions
666,1449,"CO2 from commercial aviation linked to passenger movement in narrowbody, then widebody, then regional aircraft"
667,1451,The planet's average surface temperature rise
668,1452,"Warming occurred in past 35 years, 5 warmest years since 2010"
669,1453,"Not only was 2016 warmest year on record, 8/12 months warmest"
670,1454,"oceans absorbing increased heat, top 700m/2300ft warmed by >0.4°F since 1969"
671,1455,Greenland and Antarctic ice sheet mass decrease
672,1458,Glaciers retreating globally
673,1460,sea level rise
674,1462,Arctic sea ice decline
675,1463,"number of record high temperature events in US increasing, record low temperature events decreasing since 1950"
676,1464,increasing intense rainfall events
677,1465,"Since industrial revolution, ocean water acidity increase"
678,1466,Increase in CO2 absorption by oceans due to human emissions
679,1467,carbon dioxide absorption in ocean layers increasing by 2 billion tons annually
680,1468,Arsonists and lightning strikes causing Australian bushfires
681,1469,Discovery of massive volcanic CO2 emissions discredits global warming theory
682,1473,Geological forces responsible for melting of polar ice sheets
683,1474,Etna's CO2 emissions
684,1475,Over 500 scientists and professionals send European climate declaration to UN Secretary General
685,1476,global mean temperature rise above 2°C
686,1477,Human produced carbon not significant factor
687,1479,Humans warming planet
688,1480,US leads world in reducing emissions after Paris Accord
689,1481,Based on the increase of solar activity
690,1482,"Proxies indicate world was same or warmer 1,000 years ago"
691,1484,new solar driven cooling period approaching
692,1485,human contribution to global warming
693,1486,greenhouse gases cause half of global warming
694,1487,NASA adjusts past temperatures
695,1488,EVS worse for climate than diesel cars
696,1490,Carbon dioxide levels last seen 3 million years ago
697,1492,Sea level rise due to climate change
698,1495,models predicted 3x more warming since 1988
699,1498,Carbon dioxide's effect on global climate
700,1499,sea level rise doesn't depend on ocean temperature or CO2
701,1502,"Temperatures in Australia increased by 0.3 degrees over the past century, not 1 degree as claimed."
702,1503,Climate models overestimating global warming
703,1504,Global warming makes Hurricane Harvey worse
704,1505,According to official figures
705,1506,likely ocean waters control knob climate change
706,1507,"Global warming not a myth, 80 graphs from 58 peer-reviewed papers"
707,1508,Global warming ceased since 1997
708,1510,Doubling CO2 levels would cause warming of 0.3-1.1°C
709,1512,Human-induced warming
710,1513,Carbon dioxide primary contributor to global warming
711,1515,Was 2016 a global temperature record?
712,1516,U.S. shatters high temperature records frequently
713,1517,Rigorous scientific research shows human activities drive climate change.
714,1519,Earth's climate change due to GHGs and particulate matter.
715,1523,Human influence on climate
716,1524,Human influence dominant cause of observed warming since mid-twentieth century
717,1525,Changing climate poses significant risks globally
718,1529,"Human activities, main cause of rapid warming since 1900s"
719,1530,Humans change Earth's climate
720,1531,Earth's climate change due to human activities
721,1532,Warming of the climate system since 1950s
722,1533,"atmosphere and ocean warming, snow and ice diminishing, sea level rising"
723,1539,cosmic rays causing climate change
724,1541,global warming exaggerates sea level rise
725,1543,Medieval warm period warmer than current warming
726,1544,Arctic ice melt
727,1545,co2 in atmosphere has little to no effect
728,1546,CO2 emissions
729,1547,water vapor
730,1548,polar bear numbers
731,1549,no empirical evidence for climate change
732,1551,coming out of the little ice age
733,1553,Winter 2009-2010 saw record cold spells
734,1555,El Niño
735,1557,Pacific Decadal Oscillation
736,1558,Thermodynamics contradicting greenhouse theory
737,1559,cloud feedback
738,1560,sea level rise predictions
739,1562,Methane causing climate change
740,1565,climate change
741,1566,Solar cycle length is the sun
742,1567,IPCC temperature rise
743,1568,sea ice increasing
744,1569,sea level rise deceleration
745,1570,humans insignificance in affecting global climate
746,1572,Phil Jones' statement about no global warming since 1998
747,1575,Arctic sea ice loss matches Antarctic sea ice gain
748,1576,solar cycles and global warming
749,1577,"Over 31,000 scientists sign OISM petition"
750,1578,less than half of scientists endorse global warming
751,1579,volcanic activity warming
752,1580,stomatal CO2 levels
753,1582,Tuvalu sea level not rising
754,1584,renewables cannot provide baseload power
755,1586,ice sheet losses
756,1588,Arctic not warming
757,1591,Murry Salby's findings on CO2 rise
758,1592,Human caused global warming disproof
759,1594,stratospheric water vapor stopping global warming
760,1598,adapting to global warming cheaper than preventing
761,1599,Cosmic rays cause global warming
762,1601,sunspot correlation
763,1602,Antarctica too cold to lose ice
764,1603,sea level rise
765,1604,CO2 increase not human caused
766,1605,retracted claim on sea level rise
767,1606,renewable energy investment kills jobs
768,1607,CO2 limits won't cool the planet
769,1608,Schmittner finds low climate sensitivity
770,1609,Greenland's ice loss
771,1614,Arctic sea ice extent lower
772,1615,Extreme weather damage costs increasing due to climate change
773,1616,UAH atmospheric temperatures
774,1617,human caused global warming attribution
775,1618,global warming during industrial revolution
776,1619,Hansen's 1988 prediction on West Side Highway being underwater in 20 years
777,1620,Great Barrier Reef
778,1622,Post disproved greenhouse effect
779,1623,Underground temperatures controlling climate
780,1625,heatwave risk
781,1626,Climate changes
782,1627,Global warming and sun
783,1629,most climate experts agree humans cause global warming
784,1631,warming trend in rural and urban areas
785,1634,Antarctica losing land ice at an accelerating rate
786,1638,Worry about global warming impacts
787,1640,Recent global temperatures unprecedented
788,1643,Gore's book accurate
789,1644,Glaciers retreating
790,1645,Cosmic rays and global warming
791,1647,Global warming worsens extreme weather events
792,1648,sea level rise
793,1649,Urban and rural regions show same warming trend
794,1652,CO2 effect observed by many measurements
795,1653,ocean warming
796,1654,Climate scientists making more money elsewhere
797,1655,Recent global warming attributed to humans
798,1656,"natural cycle balances co2, humans add extra"
799,1657,IPCC predictions underestimate climate response
800,1658,"Rising CO2 increases atmospheric water vapor, worsening global warming"
801,1659,many species endangered
802,1660,benefits of a price on carbon outweigh costs
803,1662,Greenland got warmer other parts of earth colder
804,1663,Greenland's ice loss
805,1665,effects of CO2 on terrestrial plants
806,1667,"Mars and Jupiter not warming, Sun cooling"
807,1668,arctic sea ice retreat
808,1669,Co2-temperature correlation
809,1670,Scientists determine factors for Little Ice Age cooling not causing global warming
810,1672,Global temperature rising
811,1673,co2 and sun temperature
812,1674,Early 20th century warming
813,1675,Earth warming
814,1677,a cold day in Chicago has no relation to global warming
815,1678,No known natural forcing fits fingerprints of observed warming
816,1683,PDO not responsible for global warming trend
817,1684,The 2nd law of thermodynamics and the greenhouse effect
818,1685,Climate predictions
819,1688,least impacted by climate change
820,1689,Net cloud feedback likely positive
821,1690,Human caused global warming
822,1691,Sea level rise accelerating due to rapid ice melting
823,1692,oceans warming and acidifying
824,1698,around 97% of climate experts agree on human-caused global warming
825,1700,Methane and permafrost
826,1702,CO2 levels globally
827,1703,Humidity rising
828,1705,flowers flowering earlier UK
829,1707,CO2 levels rising rapidly
830,1708,Decline in northern tree rings
831,1711,Global warming
832,1712,The sun's energy output has not increased significantly since 1970.
833,1713,ocean absorbing co2
834,1714,Monckton's use of IPCC equation
835,1715,CO2 driving climate change
836,1717,Global CO2 emission cuts
837,1718,High northern latitudes warmer today than in 1940
838,1719,When accounting for costs
839,1721,"Sea level rise since 1880, future sea level rise predictions"
840,1722,Humans' impact on global warming
841,1724,Lindzen and Choi's paper
842,1725,Iris hypothesis not withstanding time
843,1729,Delayed warming tipping points
844,1734,Jim Hansen's mid-level scenario B
845,1741,Volcanic cooling effect on global warming
846,1743,"Arctic sea ice shrinkage, summer multi-year sea ice disappearance within a decade"
847,1744,Sea level rise claims disputed due to manipulated data contradicting observations.
848,1745,The IPCC updates temperature history graphs.
849,1747,Independent inquiry found CRU's rigor and honesty
850,1751,Benny Peiser's criticism of Oreskes
851,1753,Trenberth's discussion on energy flows
852,1756,"Melting ice absorbs sunlight, heats Arctic"
853,1758,Temperature errors in Great Lakes region
854,1761,Rise in atmospheric CO2 due to human emissions
855,1765,Humans causing rise in atmospheric CO2
856,1769,CO2 emissions accelerating global warming
857,1771,Grand Solar Minimum's cooling effect on human-caused global warming
858,1772,"Preventing global warming is relatively cheap, while business as usual will cause accelerating climate damage costs that economists struggle to estimate."
859,1773,Global CO2 trend
860,1774,cern cloud experiment tested one third of requirements for blaming global warming on cosmic rays
